NEXTA Live,21710,"Головченко приехал в Россию просить денег

Карманному премьеру Лукашенко ничего не остаётся делать, кроме как слёзно жаловаться на санкции и просить поддержать усатого брата по окопу. Но кто же теперь даст ему денег, когда Россия сама столкнулась с огромным экономическим ущербом от санкций?

Весьма вероятно, что Мишустин процитирует бессмертную фразу Дмитрия Медведева.",342204,340,139,"/Пусть лука платит с наворованных счетов в ОАЭ своим омонышам зарплату/Я из другой страны , но мне всегда казалось, что украинцы и беларусы ближе друг к другу и они намного добрее, чем русские.  Я работала раньше со многими компаниями из этих трех стран. Работа с  украинскими и беларусскими сотрудниками всегда напоминала сдержанность и дипломатию европейских контор, никакой агрессии, чего не скажешь про третью страну./А че сразу-то сосать не начал?/посмотрел по россия-24, все так и есть - белорусский министр ноет российскому об убытках от санкций и просит денег и кредитов😂😂😂/Белорусь и так существует на путлеровские деньги/Рублями и дадут 😂/Биба и Боба, чем то даже они похожи ;)) приехало оно денег просить, у России самой денег на 3 недели осталось ;))/Дадут! Уверен что дадут! Просто это для граждан РФ никогда нет денег, прибавляют раз в год по 50-100 руб. а этим бабки всегда найдут!/Ну дайте вы уже маскали этому Галаватому!!!! Дайте!! Фафлю в рот!!! Пусть еблан сасет и причмокивает!!!!/Именно. А если даже о деньгах, то   что потребуют взамен? Не к добру это все./Че-то попандопало вспомнил, я себе ещё напечатаю/Такой бестолковый премьер. Как он мгимо закончил/Жаль що ці звуки фотоапаратів а не автоматів😢🤬/Вот на этом месте усатая проститутка и отвалится./Два лузера/Время нюхать огромный хуй украинского козака!/Ру блями!/Мне кажеться они уже решают кто возьмет на себя полномочия после ликвидации таракана/Бедный Мишустин ,вроде неплохой администратор ,,но в такое дерьмище вляпался и назад пути нет 🤦‍♂️🤦‍♂️🤦‍♂️🤦‍♂️/Хуипутоло прыкарытное/Бля, ещё одну Чечню нам уже не потянуть./Такие вы тут все интересные. По вашему мнению мы сидим в России и доедаем остатки гречки? Хочу вас расстроить: цены не очень то и сильно поднялись. Кажется, на Западе эти санкции больше отразились чем на нас/Ебаная попрашайка/А где головченко а где мишистин? Вы что постите?//Тут не о деньгах речь. Надо быть на чеку. Ходок один, теперь другой... Тут???/Денег нет, но вы держитесь/Денег нет но вы держитесь/Я никогда белорусов не считал  и не считаю врагами , лишь лукшистов ...и путинистов/Два додика,  как же они смешно смотрятся/Z означает зомби/пусть у друг друга отс..сут фашисты гребаные./Фото для никролога/Политики раши и Беларуси какие-то как с советского времени-пожилые ,с животами,с какими-то старыми стандартами…/За народ россии говорить не буду, а вот беларусы не считают украинцев врагами и никогда не считали. За многовековую историю беларусы с украинцами никогда не воевали и, очень надеюсь, что у ВС РБ хватит мозгов и сейчас не воевать. Враг Украины - лукашенко и его режим. К сожалению, нам не хватило смелости, сил смести этот режим в 2020 году, в этом народ Беларуси виноват перед народом Украины. Но, ещё раз повторю, мы не враги, враг Украины - лукашенко./какая безсмертная фраза Медведева?/Путин требует от Китая оружия, конечно, на какие деньги? Китаю не терпится поймать медведя/Могут дать только в рублях!/Губернатор БНР лукашенко уже по статусу равен пушилину и кадырову/Лучше бы с автоматов их расстреливали, а не с объективов ;)/...однобокие все какие то.....ваш зеленский по жизни у всех денег просит и защиты...на это вы внимание не обращаете... еще и не возвращает потом...а тут....очнулись....клоуны/Украинцы в своем глазу бревна не замечают?/Писю на воротничек ему..../Белорусские власти в своем репертуаре. Рублей в Москве могут напечатать и дать. Санкции полезны для экономики, так они говорили?/Два орка/Рома-кавалерыст прыехаў за залатым запасам Вовачкі падкаблучніка./Вот бы это был звук от Калаша//Жалкие пиздаболы,и московские суыкуны!! Завтра вы проснетей и будете просить милостыню на вокзалах! Уебаны...щоб ви всi здохли! Смерть москалям i прихвостням московским! Пiдараша/Так там одни кричат что санкции только стимулируют чтото, вторые тоже аж со штанов выпрыгивают как им классно от санкций и как они щас с колен встанут. А по факту как всегда/Так это же Украины территория!?//Пхахаха, младший брат приехал побираться 😂////Денег нет, пиздуй за кораблём/Коли народ росії та Білорусі зрозуміють що їх вороги не українці а їхні чиновники , тоді між нами може настати дружба/кстати да.они ж могут до бесконечности рубли печатать/Не санкции хуйня/Два брата акробата и загнуться вместе/Денег нет, но вы сосите/Ряхи/Мерзкие морды/Зачем было выстаивать отношения только с Россией.../какое славное пушечное мясо с иконкой на аватарке. Ты готовся малыш, желаю тебе лично отведать что такое война...//Wow, this prose is very articulate and descriptive. Did A woman write this post? 🙂/Ничего, ведь рашисты по жизни терпилы, а следовательно можно подтянуть ещё пояса./Ахаха по факту 😆////Встретились как-то два бомжа..как начало анекдота какого-то/ВСЁ СБЫВАЕТСЯ!
Как и предсказывали:
Рухнет режим Путина - рухнет сразу же и режим Лукашенко 🐖🐓//////В Украине происходит геноцид мирного населения! Необходимо обращаться во все инстанции по всему миру чтобы положить этому конец! Пишите на страницах всех корпораций, брендов, западных политиков, организаций и знаменитостей!

Right now Putin is committing genocide in Ukraine! Russian military forces bomb cities and murder civilians! Please send military and humanitarian aid to #Ukraine! Introduce the most severe sanctions against #Russia! We must stop Putin together and prevent his further war crimes!

Прикрепляйте видео и фото бомбежек и убийства мирного населения! Пусть весь мир знает, что творит нацист Путин!/Живу тут и сам ахуел 🤣/С о с ать/Головоебченко/Смерть русским солдатам/Денег нет, но вы сосите…/Грошей нема, іди нахуй і попутного вітра тобі в сраку!/Маски-шоу отдыхают 🤣/Омерзительные твари/встреча уголовников в верхах/Берлин обратился к Варшаве с просьбой приостановить отправку в Германию поездов с беженцами из Украины.

Об этом сообщил замминистра внутренних дел Польши Павел Шефернакер.

Он также отметил, что масштабы эмиграции с Украины ""застали всю Европу врасплох""./Да не, просто возьмет как обычно в карманах россиян и отдаст ему/Встретились два недоеблана,  а плешивый с усатый еблана ,не договорились?/Нет радости на лицах.../Головченко алкаш/Видно, привёз ответ - на что-то Григорыч таки согласился/Как выглядит команда молодого президента Зеленского и как эти нафталиновые совки Про различие в содержании и говорит не нужно/на морде два тракториста встретились, только зачем-то костюмы напялили/Пусть отработает, будем туалеты мыть в кремле/Денюх нет, и за рассею не держитесь. Сами отправлены по направлению русского корабля."
NEXTA Live,21709,"Депутаты от партии «Блок Владимира Сальдо» осудили действия своего лидера, экс-мэра Херсона и пророссийского коллаборциониста, вышедшего вчера с советской символикой в поддержку оккупантов.",385226,138,49,"/Да,ты прав, каждый день новости как рашисткие собаки херачат по мирному населению и в Донбассе, и на Волыни, и на Черниговщине, и на Харьковщине, и на Сумщине. Смерть рашистким оккупантам!/Иди нахуй, пособник русских оккупантов. Никто по украинскому Донбассу не стреляет./Оккупанты с советской тематикой ничего общего не имеют./А до этого они не видели что он гнида?/Их от туда и привозят/ВСУ ЖЕ СТРЕЛЯЕТ ПО МИРНЫМ ЖИТЕЛЯМ. Там нет военных. Там дети погибли. Смотрите разные источники./Это ж графика из игры./Как обычно рашафашисты стреляют по мирным уже восемь лет. Нет никакого дамбаца, это Донецкая и Луганская обл. Украина. Как вышебут эту Zнечисть с нашей земли , ни кто ни куда стрелять не будет////Эти алигархи все продажные, только коренной народ переживает за свои дома и земли, а эти везде себе родину купят/Украинское правительство😁 некакой вашей хочет идти на компромисс/Аллё, люди!!! При чём здесь ссср?  Каким боком он к капиталистической рашке😂
Вы не доганяете, что они ищут   способ в очередной раз обосрать совок, при том что  заслуги ссср приписывают себе/хуясе поворот./Залупу он у вас це Украина донбасс/пора стрелять таких или кто то думает что это не война????!!!!!!/Оксана/Предателям нет места в будущей, прекрасной Украине!
Слава УКРАИНЕ!/Правда на нашей стороне!/Донецк сегодня🥶/Сальдо расстрелять надо////Йобнуте....гнати в шию...або в тюрму на 20років хай подумає.../Модочага/Не понимаю как россияне могут терпеть этот СССР 2.0, скоро начнут в ГУЛАГ отправлять, а эти рабы и дальше будут кричать ""Великая рассия"", ""Путин молодец""/Ну шо, расиянские свинособаки, шах и мат... в голове у расиянцов только одна извилина, и то коричневая!!😆😆😆 или это кто то насрал ему в череп, как думаете??🤔🤔

Вас- расиянских свинособак, мы убивали, убиваем и будем убивать всегда!!/Да замочите их подстилок..../Осудили…выразили озабоченность и беспокойство… надеюсь он уже в разработке сбу/NEXTY поддерживали русские когда война была, самое время вступить против 😂/Трусы! Боятся что расстреляют свои же. Да свободной Украине! Нет западным подстилка!/Это что за техника?/Почему измену у типа свой взгляд/При встрече пиздить пидара на госизмену в военное время./Надеюсь, он будет жёстко наказан за свои коллаборационизм и госизмену./😂🇺🇦/👍🏻🇺🇦/Уже кидали новость о том, что сегодня по Донбассу херачили, по мирному населению? Или у нас таких регионов уже не существует🤔/Что делать с предателем, все знают так что не долго жить осталось/Этих психбольных с митинга за рашку, сразу в дурку отвезти нужно на обследование. 
Ни один здравомыслящий человек, не захочет загонять себя в тоталитарную - мусорскую помойку, из которой все наоборот бегут/😡/⚡️""Азов"" в Мариуполе уничтожает российских оккупантов.

Одно из самых крутых видео, которые я видел за последнее время.🇺🇦💪💪💪/🐓🐓🐓/Наверно его пытали…///😁"
