NEXTA Live,21716,"Польша приняла 1,8 миллиона беженцев из Украины",253502,238,88,"/Закройте небо!!!/Jebać Putlera!! Niech go chuj zastrzeli.  Ukraincy witamy w Polsce./Бедная Польша/Путані краще на війну гроші виділяти😥 краще б своєму народові допоміг//Кому они там такие нужны 👆💩//Не самые экземпляры лучшие бегут ) судя по видео поляков. Пьяные, шумные, все им должны...гопота./Так вы же нас освобождаете зачем убегать??)забыл методичку поменять???/Орк це діти і жінки в більшій масі/поэтому пол мира  закрыты для русни? вас даже увидеть не хотят 🤢/Спасибо, Польша!/Да я шарю как вы видите. Прилетела ракета от точки у, которых у России нет, зато есть у Украины, а вы уже во всех СМИ орете что опять оккупанты по гражданским стреляют
То, что Путин хуйло и что Россия оккупирует ваши территории я не отрицаю, лишь хочу донести что вы сражаетесь чтобы не стать рабами, но при этом ими и являетесь, только у другой власти/Пох, пускай будет, в хозяйстве всё пригодится! Всё в дом, всё в семью! 🤣🤣🤣/Бро, я не тебя ботярой назвал, а того, кому ты ответил/И пускает фури в Белорусию.../Сука какие же вы тупые,мы все новости сейчас в окно и на улицах видем/Ник больше года не менял и не собираюсь, у тебя же мой ник уже несколько раз сменился. Ну ладно, шизофрения и умственная отсталость не по моей части.
А сообщения я отправляю, потому что надеюсь что украинский народ поумнеет и начнет думать над правдивостью новостей, а не слушать лишь то дерьмо, что им СМИ в уши льют/Господи какой ты недоразвитый,я понимаю ты российский пропагандон ,но не опускайся уже так низко,за тебя стыдно/Потому что админ паблика однобокий спермоглот и ставит свое мнение в основу, а не обьективность...что и как ему выгодно,он так и преподносит...по сути тот же вечерний мудозвон...только по другую сторону...независимое мнение?!...нет, не слышали! Это очень нелепо выглядит... )/а хули бежим?а землю свою защищать кто будет?/И что ты будешь делать с этой территорией придурок?
Вы уже много где взяли територии и что ты лично с этого имеешь? Везде где вы там одна кровь и трупы, одна пустыня, даже если бы  вы завоевали  всю планету вы бы сделали тоже самое, высосать ресурсы и превратить всё в дерьмо.
Пока другие страны уже колонизируют другие планеты, то вы как дикари всё бегаете и думаете как забрать что то у других, спиздить, убить, унизить, это и есть ваша сущность вы ничего больше не умеете./У каждого свои недостатки/Ого сколько свиней переехало/Ja pierdole//Нахуя тебе территория, гений? У России огромные территории сейчас, много ты с них поимел? Крым добавился, лучше жить стали?? Много ли россияне имеют от своих недр и территорий? Ни.ху.я.  Или чтоб было чем с китайцами расплачиваться? Потому что у нас итак тысячи гектаров, никак не задействованных в пользу людей./Вот кто настоящие братья./Да небалеи, у них еды хватает на много, и нещитаи уже кто сколька сьедает. ЕтоПльша а ни россия/И турков с греками помирил, осталось только плешивому свалить с Украины и сдохнуть ✌🏻/А не приведет ли это к гуманитарной катастрофе в Украине .../А зачем ляхам столько шлюх?/Великие люди, кто знает как сопереживать , как помогать и что такое добро ! Дзякую !/Боде нам молиться на Польшу надо! Вялікі дзякуй/Ура! Пусть Польша теперь радуется быдлу и увидит какие они ""отличные"" Люди. 😂/Почему люди которых
 ,, освобождает,, руЦцкий мир - бегут не в рАссею , а в Польшу?/Дим, самому не надоело ещё?
Ватники не сидят в телеге, они у телевизоров. А те, что поддерживают украинцев, подвергаются травле в интернете - и на митинги они ходят не так, и голову под дубинки поставляют не эдак, а следовательно и дети их должны сдохнуть без лекарств./Поляки молодцы! Почему беларусь не принимает своих братьев славян??!!. А кормит иракцев на Брузгах!!/Odpowiedzą nam za masakrę wołyńską.../Witamy serdecznie./Что хлопцы, заработки закончились лет на 10 минимум/Ты КЛОУН 🤡 ЗАКРОЙ СВОЙ РОТ/Поляки что буду и делать с 2 ,5 млн беженцев??? Кормить за счет налогов самих поляков/Только 11 ноября не выходи гулять! Бить там будут всех, проходили уже/Чем вы их кормить будете клоуны польские ..../Слава Украине! Держитесь, ребята! С вами весь мир!/Это рабочая сила, не выгонят. Поляки таким заниматься не будут./Сегодня прилетела ракета в Донецк и погибло 26 человек почему НЕ Х Та сюда не выкладывают ??? Вам не кажется странным?)/путлер сдохни/Молодцы !/Это ботяра, каждый день это сообщение отправляет, даже ник пару раз сменился./Сгинь отсюда, ватный гандон/Реально братский народ... А не мокшанские свиньи/Низкий поклон полякам, не забудем их доброту/Ужасные цифры. Теперь то эти люди ""полюбят"" ""Освободителя"" Владим Владимыча. Держитесь украинцы. Здравомыслящие россияне за вас. Но нам походу тоже придётся уезжать. Ваты ещё процентов 50. Реально. Сами в говне. И радуются что у других айфонов и шмоток с макдаком больше не будет. Обреченая страна./Странно, на Россию столько негатива, а про ВСУ ничего. Даже наоборот, спасибо им говоришь. Ещё один кто верит в святость ВСУ?/Эх,жалко гастробайтеров наших,все цены поперебивают)/Зря/Прям всі німці, чи ті «німці», які вийшли з радянським прапором в Берліні?/Офигеть там муравейник 😂😂😂/Ты сильно не расстраивайся с этим тяжело но можно жить/Спасибо за адекватные слова/Долбаеб ты ебаный 😂/Благодарность навсегда Польше за добрососедст
во, прием,кров и пищу../Niech zyje Polska🇵🇱/Спасибі польські браття ❤️//Пусть всех забирают, оставьте нам только территорию! Ну и тех кто не против быть в составе России!🤣🤣🤣/Немцы уже просили не отправлять их к ним....)///Интересно через какое время поляки завоют и сами же начнут гнать их обратно?//Например таких/теперь 🇵🇱 цэ 🇺🇦/Бідні люди. Страшно покидати свій дім. Страшно не знати що буде далі./Ты обосрался/Красавцы ебать его рот/если правильно подойти, можно сделать сильный скачек экономики вверх. А если не правильно... то может и пиздец начаться/Ти підар/асвабадители прошлого/путлер сдохни//Мы с вами 🇵🇱🇺🇦!/Справжні брати поляки, а коментом вище - далбойоб/Я русский/Пишу свой пост для ватников в 100тый раз чтобы глаза открыть!
Сдохни путин тварь и те кто выполняют фашисткие приказы!!! Я россиянин-русский живу всю жизнь в России -НН (мне 47) и ненавижу тебя уже 22 года сука ты тупая!!!! Как ты начинал с убийства русских в Москве в 99году(ватники гуглите рязанский сахар в 99м) а также Курск, Беслан и миллион убыли в год населения(ватники гуглите росстат, в 2021 к примеру убыль населения 2.1млн) и пенсионеры которые дерутся на мусорках за просрочку, и постоянные обещания Ветеранам жилье (но о них он вспоминает ради пиара на 9мая и жилья нет а их все меньшеи меньша а гнида путлер только пиздаболит), а сейчас братьев украинцев гробит!!! Путлер и те кто поддерживают его и выполняют  преступные приказы горите в аду черти и фашисты!!! Спасибо украинцы за то что боретесь за весь здравомыслящий мир с мордором и настоящим злом!!! СЛАВА УКРАИНЕ!!!!/"
